{
  "case_id": "P5B-DETECT-02",
  "environment": {
    "backend": {
      "cells": 32,
      "name": "L4 finite-volume subject"
    },
    "platform_machine": "AMD64",
    "platform_system": "Windows",
    "processes": 1,
    "python": "3.12.10",
    "python_implementation": "CPython",
    "subject_id": "JSS-S02",
    "threads": 1
  },
  "event_count": 8,
  "events": [
    {
      "accepted": false,
      "after_hash": null,
      "before_hash": null,
      "candidate_id": null,
      "event_type": "BeginAttempt",
      "field_name": "direct",
      "owner": "Host",
      "residual_version": null,
      "sequence": 1,
      "source_plane": null,
      "tangent_version": null
    },
    {
      "accepted": false,
      "after_hash": "511a747990f8795a2b4da39946039a8c89fa442b3a98cef12a91ddb8a6bfa6a7",
      "before_hash": "511a747990f8795a2b4da39946039a8c89fa442b3a98cef12a91ddb8a6bfa6a7",
      "candidate_id": "da02889aa4b02c82cee5dfc4dcea2abac832ddd61111e0717afd7b909580e570",
      "event_type": "TrialEvaluate",
      "field_name": null,
      "owner": null,
      "residual_version": "L4-FV-R1",
      "sequence": 2,
      "source_plane": null,
      "tangent_version": "L4-FV-K1"
    },
    {
      "accepted": false,
      "after_hash": null,
      "before_hash": null,
      "candidate_id": "4f9e3d43f83714247a925045049286362d345967c171729dbd956bec5a626901",
      "event_type": "RejectAttempt",
      "field_name": null,
      "owner": null,
      "residual_version": null,
      "sequence": 3,
      "source_plane": null,
      "tangent_version": null
    },
    {
      "accepted": false,
      "after_hash": "511a747990f8795a2b4da39946039a8c89fa442b3a98cef12a91ddb8a6bfa6a7",
      "before_hash": "511a747990f8795a2b4da39946039a8c89fa442b3a98cef12a91ddb8a6bfa6a7",
      "candidate_id": "4f9e3d43f83714247a925045049286362d345967c171729dbd956bec5a626901",
      "event_type": "OutputAcceptedState",
      "field_name": "pressure_feedback",
      "owner": "AcceptedOutputMirror",
      "residual_version": null,
      "sequence": 4,
      "source_plane": "rejected_trial",
      "tangent_version": null
    },
    {
      "accepted": false,
      "after_hash": "511a747990f8795a2b4da39946039a8c89fa442b3a98cef12a91ddb8a6bfa6a7",
      "before_hash": "511a747990f8795a2b4da39946039a8c89fa442b3a98cef12a91ddb8a6bfa6a7",
      "candidate_id": "4f9e3d43f83714247a925045049286362d345967c171729dbd956bec5a626901",
      "event_type": "Rollback",
      "field_name": null,
      "owner": null,
      "residual_version": null,
      "sequence": 5,
      "source_plane": null,
      "tangent_version": null
    },
    {
      "accepted": false,
      "after_hash": null,
      "before_hash": null,
      "candidate_id": "370d3af06cee8ee3be751cbcd23f5e742dfd5c92230541073aee9ff635824b49",
      "event_type": "FormResidual",
      "field_name": null,
      "owner": null,
      "residual_version": "L4-FV-R1",
      "sequence": 6,
      "source_plane": null,
      "tangent_version": "L4-FV-K1"
    },
    {
      "accepted": true,
      "after_hash": "b87b30faac4219a1c77bf2f01ad5b449f5fc90b7ea521570cbb5c04d8e06a8b0",
      "before_hash": null,
      "candidate_id": "370d3af06cee8ee3be751cbcd23f5e742dfd5c92230541073aee9ff635824b49",
      "event_type": "AcceptCommit",
      "field_name": null,
      "owner": null,
      "residual_version": null,
      "sequence": 7,
      "source_plane": null,
      "tangent_version": null
    },
    {
      "accepted": true,
      "after_hash": null,
      "before_hash": null,
      "candidate_id": "4f9e3d43f83714247a925045049286362d345967c171729dbd956bec5a626901",
      "event_type": "OutputAcceptedState",
      "field_name": null,
      "owner": null,
      "residual_version": null,
      "sequence": 8,
      "source_plane": "rejected_trial",
      "tangent_version": null
    }
  ],
  "implementation_revision": "JSS-P5B1-RUNTIME-1.0",
  "measurements": {
    "accepted_field_delta": 0.0,
    "converged": true,
    "diagnostics": {
      "callback_bias": 0.0,
      "cell_count": 32,
      "direct_candidate": "da02889aa4b02c82cee5dfc4dcea2abac832ddd61111e0717afd7b909580e570",
      "feedback": 9.964146600566573e-11,
      "model_fingerprint": "5a6fc2a316e676f04f83db96e7b228cbdc0330507fe9fc1e378b2e98212f6f64",
      "perturbed_candidate": "370d3af06cee8ee3be751cbcd23f5e742dfd5c92230541073aee9ff635824b49",
      "rejected_candidate": "4f9e3d43f83714247a925045049286362d345967c171729dbd956bec5a626901"
    },
    "finite": true,
    "operator_replay_drift": 9.964146600566573e-11,
    "output_provenance_violation": true,
    "seed_strength": 1e-10
  },
  "raw_observation": {
    "evidence_tokens": [
      "LATER_OPERATOR",
      "OUTPUT_SOURCE"
    ],
    "execution_error": null,
    "lifecycle_signals": {
      "authoritative_state_mutation": false,
      "commit_violation": false,
      "operator_replay_drift": true,
      "output_provenance_violation": true,
      "ownership_violation": false,
      "within_history_version_violation": false
    },
    "packet_a": {
      "committed_state_hash": "f4a9cd969f450321cf283071a30355f8cdba12994705f0cc9166731f0c1ebc5e",
      "environment_hash": "ae089febb9e3b82896725944c34be11741507d91d4bf0e33809a2b08b67a7c7e",
      "load_hash": "9a5d99145c59bc939235b89d10dcbcb8c1d13e722a883ccb9f99328debf47c1d",
      "persistent_projection_hash": "62c534ddc2027c658500f69b6056d9cf61b516684ad00439273a8eb8114e9ced",
      "primary_state_hash": "b90cb3a11489408f6f25da06200805d8b464b236b90c6399906df1ebf91fa85c",
      "residual_version": "L4-FV-R1",
      "tangent_version": "L4-FV-K1"
    },
    "packet_b": {
      "committed_state_hash": "f4a9cd969f450321cf283071a30355f8cdba12994705f0cc9166731f0c1ebc5e",
      "environment_hash": "ae089febb9e3b82896725944c34be11741507d91d4bf0e33809a2b08b67a7c7e",
      "load_hash": "9a5d99145c59bc939235b89d10dcbcb8c1d13e722a883ccb9f99328debf47c1d",
      "persistent_projection_hash": "62c534ddc2027c658500f69b6056d9cf61b516684ad00439273a8eb8114e9ced",
      "primary_state_hash": "b90cb3a11489408f6f25da06200805d8b464b236b90c6399906df1ebf91fa85c",
      "residual_version": "L4-FV-R1",
      "tangent_version": "L4-FV-K1"
    },
    "precomparison_relation": "compatible"
  },
  "run_id": "run_2",
  "runtime_mode": "L4_FV_OUTPUT_FEEDBACK",
  "schema_version": "JSS-P5B-RUNTIME-OBSERVATION-1.0",
  "semantic_fingerprint": "4ed00d39da2681fccd64e87d9463346609ca2cce7e448ee9a12eefc29e836cdc",
  "subject_id": "JSS-S02"
}
